EIB and KBN to reopen dollar SSA market KfW readies euro return,The pipeline is starting to fill in the public sector bond market with the European Investment Bank and Kommunalbanken set to bring dollar deals and KfW preparing its first euro benchmark of the year. More deals — including the first sovereign syndication of the year— are set to follow this week.,06 Jan 2020,https://www.globalcapital.com/article/b1jsdvp8cntq6q/eib-and-kbn-to-reopen-dollar-ssa-market-kfw-readies-euro-return
ISDA hires new policy head,The International Swaps and Derivatives Association has appointed Su Yen Chia as its new head of Asia Pacific public policy.,06 Jan 2020,https://www.globalcapital.com/article/b1jsdvkj5pywlg/isda-hires-new-policy-head
KfW sets new size record in sterling KBN to follow,KfW broke new ground in the sterling bond market on Monday by bringing its largest ever benchmark in the currency. Kommunalbanken is looking to latch on to the red hot market too after picking banks to lead a new December 2024 trade.,06 Jan 2020,https://www.globalcapital.com/article/b1jsds73vcqnkk/kfw-sets-new-size-record-in-sterling-kbn-to-follow
Morgan Stanley brings Dutch RMBS with 99% IO loan exposure,Morgan Stanley is bringing the first European RMBS deal of the year the Dutch Delft 2020 a €268.3m deal backed almost entirely by interest-only loans.,06 Jan 2020,https://www.globalcapital.com/article/b1jsd0y2pj6f0x/morgan-stanley-brings-dutch-rmbs-with-99-io-loan-exposure
Early equity prints to prove tricky in volatile market,Many investors made their first trades of the new year on Monday selling risk positions. That has thrown into doubt issuers' plans to bring new business to the primary market.,06 Jan 2020,https://www.globalcapital.com/article/b1jsd2yy5cdrj0/early-equity-prints-to-prove-tricky-in-volatile-market
Edeka Rhein-Ruhr rings up expansion debt,German grocer Edeka Rhein-Ruhr has signed up to €262.8m of debt from commercial and state banks as it looks to build infrastructure after increasing revenues by 150%.,06 Jan 2020,https://www.globalcapital.com/article/b1jscztxhg73hp/edeka-rhein-ruhr-rings-up-expansion-debt
Aker BP flexes new muscles with bond targeting IG buyers,Norwegian oil exploration and production company Aker BP is positioning itself as an investment grade issuer with a new dual tranche dollar mandate with a call targeting bond buyers with IG mandates and an unsecured issue structure. The company received its second IG rating last November.,06 Jan 2020,https://www.globalcapital.com/article/b1jscz5fk3nyst/aker-bp-flexes-new-muscles-with-bond-targeting-ig-buyers
JP Morgan retains global IG lending crown BNPP European champ,JP Morgan was the top bookrunner for investment-grade syndicated loans globally in 2019 again though BNP Paribas was the bank to beat in Europe.,06 Jan 2020,https://www.globalcapital.com/article/b1jscyq08xfwf6/jp-morgan-retains-global-ig-lending-crown-bnpp-european-champ
Atlantica Yield opens US PP market with debut offering,Atlantica Yield formerly the UK-based energy yieldco Abengoa Yield has launched a debut US private placement which is the first US PP offering in 2020 in Europe.,06 Jan 2020,https://www.globalcapital.com/article/b1jsd07m65g7wv/atlantica-yield-opens-us-pp-market-with-debut-offering
FTSE Russell grows ESG research coverage in Apac,Index provider FTSE Russell is expanding the remit of its sustainability investment research in Asia Pacific to include hundreds more Chinese and Japanese securities.,06 Jan 2020,https://www.globalcapital.com/article/b1jsd9g93mzrf3/ftse-russell-grows-esg-research-coverage-in-apac
Chilean issuers remain bullish as CMPC leads Lat Am off the blocks,Chile’s head of international finance has told GlobalCapital that the debt management office is making communication with investors its number one priority as it announced borrowing plans — including an atypically large amount of international issuance — earlier than usual after a turbulent fourth quarter.,06 Jan 2020,https://www.globalcapital.com/article/b1jsc6nfbhsm36/chilean-issuers-remain-bullish-as-cmpc-leads-lat-am-off-the-blocks
Banks consider delaying Middle East ECM deals as US/Iran tension grows,A weekend of hostile rhetoric between Iran and the US has caused equity capital markets bankers to consider delaying new deals from the Middle East despite a healthy issuance pipeline over fears that the two countries are gearing up for war.,06 Jan 2020,https://www.globalcapital.com/article/b1jsc5r575npfy/banks-consider-delaying-middle-east-ecm-deals-as-usiran-tension-grows
Sonangol set to tap lenders for $1bn,Angolan national oil company Sonangol will soon launch syndication for a loan that could be as large as $1bn according to bankers though most expect the African pipeline in the early year to remain muted.,06 Jan 2020,https://www.globalcapital.com/article/b1jsc50g90mxr6/sonangol-set-to-tap-lenders-for-$1bn
Israel shrugs off Iran concerns with year’s first mandate,The State of Israel was first out of the blocks for emerging markets bonds on Monday as it announced a dual tranche dollar offering despite market participants' continued caution after the US assassination of Qassem Soleimani.,06 Jan 2020,https://www.globalcapital.com/article/b1jsc3cq1sjyxd/israel-shrugs-off-iran-concerns-with-years-first-mandate
Rabo kicks off 2020 by targeting debut non-pref in sterling,Rabobank opened books on its first ever non-preferred senior deal in sterling on Monday as it sought to take advantage of a general lack of a supply in the currency over the course of the last couple of months.,06 Jan 2020,https://www.globalcapital.com/article/b1jsc4gnbt5n93/rabo-kicks-off-2020-by-targeting-debut-non-pref-in-sterling
Leeds benefits from ‘unparallelled’ demand for sterling covered bond,Leeds Building Society opened books on Monday for its second Sonia-linked covered bond. The trade benefited from an ‘unparallelled’ level of demand reaching almost four times its £600m size.,06 Jan 2020,https://www.globalcapital.com/article/b1jsbw93qvyshx/leeds-benefits-from-unparallelled-demand-for-sterling-covered-bond
Lobbyist complains about UK bank wind-down rules,UK Finance has said that the array of different regulatory requirements for firms is increasing operational risks with the approach to solvent wind-downs one example of regulators contradicting each other.,06 Jan 2020,https://www.globalcapital.com/article/b1jsbhfwxhg86y/lobbyist-complains-about-uk-bank-wind-down-rules
FICC boss leaves Citadel Securities,Brian Oliver head of EMEA and APAC FICC distribution at Citadel Securities has left the market making firm and begun gardening leave.,06 Jan 2020,https://www.globalcapital.com/article/b1js9vdlmws19s/ficc-boss-leaves-citadel-securities
LBBW set to be first of FIG in 2020,LBBW has picked banks to arrange the sale of a new euro covered bond as activity in the market gets off to a slower start than usual following the new year break.,06 Jan 2020,https://www.globalcapital.com/article/b1jsb3skzkhpn0/lbbw-set-to-be-first-of-fig-in-2020
Ex-StanChart Mizuho debt banker joins CreditSights,Senior debt capital markets banker Pramod Shenoi joined independent research firm CreditSights at the end of last year.,06 Jan 2020,https://www.globalcapital.com/article/b1js9cdqrhqbzy/exstanchart-mizuho-debt-banker-joins-creditsights
Natixis hires sponsor finance M&A heads,Natixis has made two new hires for its Asia sponsor finance and mergers and acquisitions teams in Hong Kong.,06 Jan 2020,https://www.globalcapital.com/article/b1js9cdnyd8jzn/natixis-hires-sponsor-finance-mampa-heads
Asian bonds poised for busy week,Asian bond issuers went full speed ahead with their fundraising plans on Monday launching new deals ahead of Chinese New Year holidays at the end of the month.,06 Jan 2020,https://www.globalcapital.com/article/b1js8g4pk0g1tr/asian-bonds-poised-for-busy-week
MicroPort plans to spin off CardioFlow unit,Hong Kong-listed MicroPort Scientific Corp is looking at spinning off and listing its heart treatment subsidiary according to a stock exchange filing.,06 Jan 2020,https://www.globalcapital.com/article/b1js81nqfy3x4r/microport-plans-to-spin-off-cardioflow-unit
The week in review: PBoC cuts RRR China deepens loan benchmark reform regulators roll out bond default disposal rules,In this round-up China’s central bank cut the required reserve ratio by 50bp on Monday domestic financial institutions have been told to price loans based on the new benchmark and regulators have published draft rules on dealing with corporate bond defaults.,06 Jan 2020,https://www.globalcapital.com/article/b1js77ryntk8h4/the-week-in-review-pboc-cuts-rrr-china-deepens-loan-benchmark-reform-regulators-roll-out-bond-default-disposal-rules
Chinese biotech firm I-Mab launches $111m US listing,I-Mab a China-based biopharmaceutical company has kicked off the roadshow for its up to $111.1m Nasdaq IPO more than two months after filing draft documents with the US regulator.,06 Jan 2020,https://www.globalcapital.com/article/b1js6p1gjn9nr3/chinese-biotech-firm-i-mab-launches-$111m-us-listing
Dechert hires Pedersen in Singapore,Global law firm Dechert has hired Maria Tan Pedersen as a partner in its Singapore office in a bid to expand and strengthen its corporate and securities practice in the region it said on Monday.,06 Jan 2020,https://www.globalcapital.com/article/b1js6mh4gqlznp/dechert-hires-pedersen-in-singapore
Six more European nations could issue green,Market participants are forecasting a strong year of growth for the green bond market in 2020 after it reached record issuance in 2019.,03 Jan 2020,https://www.globalcapital.com/article/b1jr3v0g8mcrvq/six-more-european-nations-could-issue-green
Oodle Finance plans to be ‘repeat issuer’ as balance sheet booms,Used car finance platform Oodle plans to be a repeat issuer in securitization following break-neck growth that’s seen originations grow 1000% since January 2018. The firm is now one of the UK’s largest fintech companies with a balance sheet larger than media darling Monzo Bank — while the securitization market is becoming increasingly welcoming to fintech firms.,03 Jan 2020,https://www.globalcapital.com/article/b1jr3bqfj4clgf/oodle-finance-plans-to-be-repeat-issuer-as-balance-sheet-booms
Redwood to open 2020 RMBS pipeline,Redwood announced on Thursday that it is prepping the first RMBS transaction of the new year a $459.3m deal backed by highly seasoned loans from its Sequoia shelf.,03 Jan 2020,https://www.globalcapital.com/article/b1jr318nw75612/redwood-to-open-2020-rmbs-pipeline
FIA members call for commercial-institutional compromise on IM models,The US commodities members of the Futures Industry Association have called on the US Commodity Futures Trading Commission to overhaul regulation to address operational challenges on swaps margin management.,03 Jan 2020,https://www.globalcapital.com/article/b1jr2k614w785w/fia-members-call-for-commercial-institutional-compromise-on-im-models
Respectable loan volume in 2019 as M&A buoys US market,Global syndicated lending fell back in 2019 to a level similar to that in 2013-2016 in dollar terms after two years of higher borrowing including a near-record total in 2018. The volume was the sixth highest ever and higher than that in any year before 2006.,03 Jan 2020,https://www.globalcapital.com/article/b1jr2n6kmdxf2m/respectable-loan-volume-in-2019-as-mampa-buoys-us-market
EIB and IADB make sterling start to 2020,The European Investment Bank and the Inter-American Development Bank amassed strong demand from investors to kick off their funding programmes for the year on Friday with the former receiving the biggest ever order book in the sterling supranational and agency bond market according to the leads.,03 Jan 2020,https://www.globalcapital.com/article/b1jr1qvjlq93xc/eib-and-iadb-make-sterling-start-to-2020
Charter Court TSB Bank Cerberus Newday line up for 2020 securitizations,The new year looks set for a strong start in the securitization market with SPV filings suggesting that many repeat issuers are already preparing their deals across asset classes.,03 Jan 2020,https://www.globalcapital.com/article/b1jr1zn4sd557z/charter-court-tsb-bank-cerberus-newday-line-up-for-2020-securitizations
Nationwide ‘extracts maximum value’ with tightest five year Sonia covered to date,Nationwide Building Society issued the first sterling covered bond of the year on Friday without needing to pay any premium over the tight trading levels of its existing bonds.,03 Jan 2020,https://www.globalcapital.com/article/b1jr0xg5d69blx/nationwide-extracts-maximum-value-with-tightest-five-year-sonia-covered-to-date
Assassination shock makes for nervy EM weekend,With emerging markets bond bankers all ready to start deploying their pipelines next week the US threw a potential spanner in the works on Friday when it killed Iranian general Qassem Soleimani.,03 Jan 2020,https://www.globalcapital.com/article/b1jr0r2b7g1r62/assassination-shock-makes-for-nervy-em-weekend
Chinese Christmas present for Aldesa bondholders,Struggling Spanish construction group Aldesa saw a Christmas bounce in its Caa1-rated bonds following a December 25 takeover deal and capital injection from China Railway Construction Corporation.,03 Jan 2020,https://www.globalcapital.com/article/b1jr06z2ysddj3/chinese-christmas-present-for-aldesa-bondholders
Soleimani killing punctures bullish equities,Equity capital markets bankers' bullish mood was dented on Friday by falling markets as investors reacted to escalating tension in the Middle East after the US assassination of Iranian general Qasem Soleimani. Banks are hoping this change in sentiment does not damage deal making next week.,03 Jan 2020,https://www.globalcapital.com/article/b1jr01jsbhzymz/soleimani-killing-punctures-bullish-equities
Rating agencies may downgrade MCC if it bails out Bari,Moody’s and Standard & Poor’s have both placed Banca del Mezzogiorno-MedioCredito Centrale (MCC) on review for downgrade after the Italian government confirmed it could use the state-owned bank to help recapitalise the struggling lender Banca Popolare di Bari.,03 Jan 2020,https://www.globalcapital.com/article/b1jqpb09pt5nnx/rating-agencies-may-downgrade-mcc-if-it-bails-out-bari
Crédit Agricole’s Loynes takes up new syndicate role,Damien Loynes has been appointed head of syndicate for Europe the Middle East and Africa at Crédit Agricole.,03 Jan 2020,https://www.globalcapital.com/article/b1jqz9vc153wvw/cr233dit-agricoles-loynes-takes-up-new-syndicate-role
Vingroup attracts 14 banks to $525m loan,Vietnamese conglomerate Vingroup Joint Stock Co and its automobile subsidiary VinFast have exercised part of a greenshoe option on their joint borrowing boosting the loan size to $525m.,03 Jan 2020,https://www.globalcapital.com/article/b1jqxw5tgfgkdj/vingroup-attracts-14-banks-to-$525m-loan
Central China New Life eyes Q1 IPO,Property manager Central China New Life is planning to list in Hong Kong in the first quarter said a source familiar with the transaction.,03 Jan 2020,https://www.globalcapital.com/article/b1jqxfncrlkyr1/central-china-new-life-eyes-q1-ipo
E-cigarette maker Smoore plans $500m-plus HK listing,Smoore International Holdings a manufacturer of vaping technology is lining up a Hong Kong IPO of more than $500m in the first quarter of 2020 according to a source familiar with the matter.,03 Jan 2020,https://www.globalcapital.com/article/b1jqx8qq3xt56g/e-cigarette-maker-smoore-plans-$500m-plus-hk-listing
RHB’s Hong Kong brokerage arm fined by SFC,The Securities and Futures Commission has fined RHB Securities Hong Kong HK$6.4m ($821516) for failing to comply with a number of regulatory requirements.,03 Jan 2020,https://www.globalcapital.com/article/b1jqx432f0qntv/rhbs-hong-kong-brokerage-arm-fined-by-sfc
Credit card ABS trading dwindling as big banks hold back,Once a benchmark ABS sector credit card bonds experienced a dramatic decline in issuance last year leading to big drop in trading activity that is expected to continue in 2020.,02 Jan 2020,https://www.globalcapital.com/article/b1jqqb0cryrbnp/credit-card-abs-trading-dwindling-as-big-banks-hold-back
SGX adds new member with 'internationalisation' strategy,Singapore-based Orient Futures International has become the latest trading and clearing member of the Singapore Exchange (SGX) derivatives market.,02 Jan 2020,https://www.globalcapital.com/article/b1jqn59mcp4t10/sgx-adds-new-member-with-39internationalisation39-strategy
Corporate bond rush expected next week as bankers eye maturity mix,Corporate bond bankers in Europe are raring to get deals out into what looks like a strong market but concede that with many investors still out of the office they will have to wait until the start of next week.,02 Jan 2020,https://www.globalcapital.com/article/b1jqmrgy21xs6k/corporate-bond-rush-expected-next-week-as-bankers-eye-maturity-mix
Sports ECM boom expected after Juventus rights issue,Italian football club Juventus completed a €300m rights issue at the end of December and sources say renewed investor interest in sport could herald more equity capital markets transactions going forward.,02 Jan 2020,https://www.globalcapital.com/article/b1jqml95vf2ssf/sports-ecm-boom-expected-after-juventus-rights-issue
MUFG hires Kaya for Turkey,Burak Kaya is joining MUFG Turkey to lead its corporate banking activity for non-Japanese firms.,02 Jan 2020,https://www.globalcapital.com/article/b1jqmgv5sqprp8/mufg-hires-kaya-for-turkey
From CMBS to high yield Reit: hospital finance saga nears the end,Bonds in two pre-crisis CMBS deals backed by UK hospitals are set to be repaid following a bid from Alabama-based Medical Properties Trust for 30 properties backing the deal. The Reit will fund the deal with recently signed high yield bonds drawing down the curtain on a saga which has seen the ill-fated 2007 CMBS restructured twice in the last five years.,02 Jan 2020,https://www.globalcapital.com/article/b1jqmh3h3x7gk2/from-cmbs-to-high-yield-reit-hospital-finance-saga-nears-the-end
Green finance grows in Middle East as Etihad signs loan,Etihad Airways has signed a €100m loan linked to the UN’s Sustainable Development Goals. The deal is one of the latest ESG-linked financings signed in the Middle East which is developing an appetite for sustainability-linked debt.,02 Jan 2020,https://www.globalcapital.com/article/b1jqm95k42m5z5/green-finance-grows-in-middle-east-as-etihad-signs-loan
Ericsson dials in $150m 5G R&D funding,Ericsson the Swedish telecoms equipment group has signed a $150m credit facility which it will use to research and develop 5G technology.,02 Jan 2020,https://www.globalcapital.com/article/b1jqlz1jv81tc3/ericsson-dials-in-150m-5g-rampd-funding
Lower Saxony kick-starts euro SSA market as EIB preps sterling reopener,The Federal State of Lower Saxony sold the first euro public sector benchmark of 2020 with a well received 10 year deal on Thursday. Meanwhile the European Investment Bank is keeping to tradition of beginning its benchmark funding for the year in sterling.,02 Jan 2020,https://www.globalcapital.com/article/b1jqlzhdqm3p34/lower-saxony-kick-starts-euro-ssa-market-as-eib-preps-sterling-reopener
Banks warned dragging feet on Libor transition could lead to PPI-style claims,Banks have been warned that their tardiness in switching away from the Libor benchmark could leave them open to compensation claims similar to those that followed the UK's £50bn scandal of banks mis-selling payment protection insurance. However bankers involved in the process say they are working hard to complete the transition.,02 Jan 2020,https://www.globalcapital.com/article/b1jqlsfnjpz214/banks-warned-dragging-feet-on-libor-transition-could-lead-to-ppi-style-claims
Euro FIG market set for ‘slower start than normal’,Financial institutions could take longer than usual to return to the euro bond market at the start of 2020 with the early issuance window having been broken up by the holiday period.,02 Jan 2020,https://www.globalcapital.com/article/b1jqltn77h4ssw/euro-fig-market-set-for-slower-start-than-normal
EM syndicates prep pipelines for January rush,Bankers and investors do not expect emerging market bond sales to get underway until next week but from then on execution should ramp up rapidly with Saudi Arabia and Turkey among the anticipated early issuers.,02 Jan 2020,https://www.globalcapital.com/article/b1jqlcxbb8l59b/em-syndicates-prep-pipelines-for-january-rush
Blocks outperform surging equities bankers line up more,The end of 2019 was a bumper time for equity block trades in EMEA. After many of these accelerated trades generated strong market-beating returns for investors banks are hoping funds will have goodwill towards the market supporting a strong start to 2020.,02 Jan 2020,https://www.globalcapital.com/article/b1jql5rzmhzb90/blocks-outperform-surging-equities-bankers-line-up-more
Iceland banks target AT1 raid,Iceland’s banks are expected to launch their first additional tier one (AT1) transactions in 2020 as they push on with optimising their capital structures.,02 Jan 2020,https://www.globalcapital.com/article/b1jqksb600j0fm/iceland-banks-target-at1-raid
Mindspace lines up India’s second Reit IPO,Blackstone-backed Mindspace Business Parks Real Estate Investment Trust (Reit) is preparing an IPO of new and existing stock set to be just the second listing from the asset class in India.,02 Jan 2020,https://www.globalcapital.com/article/b1jqhdjgw082wv/mindspace-lines-up-indias-second-reit-ipo
Bonds news in brief: 2019 ends on quiet note,Industrial Securities (Hong Kong) Financial Holdings Zhengzhou Zhongrui Industrial Group Co and Shandong Iron & Steel Group Co priced international bonds during the last days of 2019 capping a strong year for Asia’s debt market.,02 Jan 2020,https://www.globalcapital.com/article/b1jqh0n7b04nv9/bonds-news-in-brief-2019-ends-on-quiet-note
Hong Kong IPO flow starts strong in 2020,It is set to be a busy start to 2020 for the Hong Kong Stock Exchange with three live IPOs in the market. The most recent launch came from Shanghai Gench Education Group which hit the road with a HK$773m ($99.2m) deal on Thursday.,02 Jan 2020,https://www.globalcapital.com/article/b1jqgjd36q9my3/hong-kong-ipo-flow-starts-strong-in-2020
Panda Green pushes back distressed exchange deadline,Chinese solar power operator Panda Green Energy Group has extended the deadline of a distressed exchange offer. The new note issuance will now be finalised in the same week that its $350m bond becomes due.,02 Jan 2020,https://www.globalcapital.com/article/b1jqfw61l7pdlq/panda-green-pushes-back-distressed-exchange-deadline
Pakistan overhauls IPO rules to revive market,Pakistan has started the year by rejigging rules for IPOs in the country in a bid to revive its fledgling stock market by attracting more listings.,02 Jan 2020,https://www.globalcapital.com/article/b1jqfsnmxjhnsg/pakistan-overhauls-ipo-rules-to-revive-market
VPBank Finance boosts borrowing to $200m,VPBank Finance Company the consumer finance arm of Vietnam Prosperity Joint Stock Commercial Bank has increased the size of its loan to $200m after seven banks joined during general syndication,02 Jan 2020,https://www.globalcapital.com/article/b1jqf86qscdlk6/vpbank-finance-boosts-borrowing-to-$200m
Title, Summary, Date, Link, 
UK picks week for 2071 tap,The UK Debt Management Office has chosen the week for its fifth and final syndication of its 2019/2020 financial year.,17 Jan 2020,https://www.globalcapital.com/article/b1jy742b7qf78d/uk-picks-week-for-2071-tap
Nationwide targets sterling senior amid welcoming conditions,Nationwide Building Society launched a three year preferred senior bond in sterling on Friday with the trade’s success coming as 'no surprise' amid a favourable backdrop in the currency.,17 Jan 2020,https://www.globalcapital.com/article/b1jy748f9xzztq/nationwide-targets-sterling-senior-amid-welcoming-conditions
LBBW mandates leads for first green sterling non-preferred,Landesbank Baden-Württemberg (LBBW) is set to become the first issuer of green non-preferred senior paper in the sterling bond market as well as the first financial institution to include sustainability ratings in a new deal mandate.,17 Jan 2020,https://www.globalcapital.com/article/b1jy6pqkcwhnby/lbbw-mandates-leads-for-first-green-sterling-non-preferred
Calisen presses ahead with first UK IPO of the year,Calisen Group the KKR-backed operator of smart metres has confirmed its intention to float on the London Stock Exchange formally launching the first major UK IPO of the year.,17 Jan 2020,https://www.globalcapital.com/article/b1jy74knbd9xvr/calisen-presses-ahead-with-first-uk-ipo-of-the-year
China market round-up: Q4 GDP December data stabilise PBoC injects liquidity ahead of Lunar New Year DBS becomes bond settlement agent,In this round-up China’s economy grows at the slowest rate in nearly three decades the central bank injects a shot of liquidity into the market through the medium-term lending facility and reverse repo and DBS Bank (China) receives a bond settlement agent licence in the interbank market.,17 Jan 2020,https://www.globalcapital.com/article/b1jy4ms9nzwl6r/china-market-roundup-q4-gdp-december-data-stabilise-pboc-injects-liquidity-ahead-of-lunar-new-year-dbs-becomes-bond-settlement-agent
