Title, Summary, Date, Link, 
UK picks week for 2071 tap,The UK Debt Management Office has chosen the week for its fifth and final syndication of its 2019/2020 financial year.,17 Jan 2020,https://www.globalcapital.com/article/b1jy742b7qf78d/uk-picks-week-for-2071-tap
Title, Summary, Date, Link, 
UK picks week for 2071 tap,The UK Debt Management Office has chosen the week for its fifth and final syndication of its 2019/2020 financial year.,17 Jan 2020,https://www.globalcapital.com/article/b1jy742b7qf78d/uk-picks-week-for-2071-tap
Title, Summary, Date, Link, 
UK picks week for 2071 tap,The UK Debt Management Office has chosen the week for its fifth and final syndication of its 2019/2020 financial year.,17 Jan 2020,https://www.globalcapital.com/article/b1jy742b7qf78d/uk-picks-week-for-2071-tap
Nationwide targets sterling senior amid welcoming conditions,Nationwide Building Society launched a three year preferred senior bond in sterling on Friday with the trade’s success coming as 'no surprise' amid a favourable backdrop in the currency.,17 Jan 2020,https://www.globalcapital.com/article/b1jy748f9xzztq/nationwide-targets-sterling-senior-amid-welcoming-conditions
LBBW mandates leads for first green sterling non-preferred,Landesbank Baden-Württemberg (LBBW) is set to become the first issuer of green non-preferred senior paper in the sterling bond market as well as the first financial institution to include sustainability ratings in a new deal mandate.,17 Jan 2020,https://www.globalcapital.com/article/b1jy6pqkcwhnby/lbbw-mandates-leads-for-first-green-sterling-non-preferred
Calisen presses ahead with first UK IPO of the year,Calisen Group the KKR-backed operator of smart metres has confirmed its intention to float on the London Stock Exchange formally launching the first major UK IPO of the year.,17 Jan 2020,https://www.globalcapital.com/article/b1jy74knbd9xvr/calisen-presses-ahead-with-first-uk-ipo-of-the-year
China market round-up: Q4 GDP December data stabilise PBoC injects liquidity ahead of Lunar New Year DBS becomes bond settlement agent,In this round-up China’s economy grows at the slowest rate in nearly three decades the central bank injects a shot of liquidity into the market through the medium-term lending facility and reverse repo and DBS Bank (China) receives a bond settlement agent licence in the interbank market.,17 Jan 2020,https://www.globalcapital.com/article/b1jy4ms9nzwl6r/china-market-roundup-q4-gdp-december-data-stabilise-pboc-injects-liquidity-ahead-of-lunar-new-year-dbs-becomes-bond-settlement-agent
China policy round-up: Top anti-corruption regulator focuses on local government debt Shanghai welcomes more tech firms and MNCs Guangdong to launch futures exchange,In this round-up Chinese premier Li Keqiang encourages local government bond issuance the Central Commission for Discipline Inspection plans to investigate corruption around local government debt and Shanghai is working to grow the Star board and attract more foreign investment into the city.,17 Jan 2020,https://www.globalcapital.com/article/b1jy4kg1stfd2n/china-policy-roundup-top-anticorruption-regulator-focuses-on-local-government-debt-shanghai-welcomes-more-tech-firms-and-mncs-guangdong-to-launch-futures-exchange
Medco Energi Bayan Resources power up dollar bonds,Indonesia's Medco Energi Internasional and Bayan Resources raised more than $1bn between them from ultra-tight bonds on Thursday.,17 Jan 2020,https://www.globalcapital.com/article/b1jy4bdjfxc279/medco-energi-bayan-resources-power-up-dollar-bonds
Bonds news in brief: Evergrande ZhengTong Auto LGFVs raise funds,Four Chinese borrowers hit the dollar bond market on Thursday competing with supply from India Indonesia and the Philippines.,17 Jan 2020,https://www.globalcapital.com/article/b1jy41f3pt0ghx/bonds-news-in-brief-evergrande-zhengtong-auto-lgfvs-raise-funds
Central Retail preps record $2.4bn Thai IPO,Thailand’s Central Retail Corp is on track to launch the country’s largest IPO with bookbuilding for the deal set to open on January 20 according to a source familiar with the matter.,17 Jan 2020,https://www.globalcapital.com/article/b1jy479hsylzg6/central-retail-preps-record-24bn-thai-ipo
Trade war diaries: phase one deal appeals to the financial industry,In the phase one trade deal signed on Wednesday between the US and China the majority of the agreements focusing on the financial sector are simply reiterations and elaborations of what the Mainland government has already said. But there are now some concrete deadlines in place to open up the domestic market further to foreign firms.,17 Jan 2020,https://www.globalcapital.com/article/b1jy42nzdlp10s/trade-war-diaries-phase-one-deal-appeals-to-the-financial-industry
Jollibee's serves 'blowout' inaugural bond,Jollibee Foods Corp the owner of the eponymous fast food chain wowed investors on Thursday with a debut $600m bond that beat the Philippine company’s targets.,17 Jan 2020,https://www.globalcapital.com/article/b1jy4c61t1j7n5/jollibee39s-serves-39blowout39-inaugural-bond
Updated: Hong Kong placements flood market in pre-CNY rush,A flurry of accelerated bookbuilds hit the Hong Kong market on Thursday night as issuers and investors squeeze through the last window for fundraising before companies go into earnings blackout and the Chinese New Year holidays.,17 Jan 2020,https://www.globalcapital.com/article/b1jy41qtght5ms/updated-hong-kong-placements-flood-market-in-pre-cny-rush
Zhongce Rubber returns for $250m refi,Zhongce Rubber Group has returned to the international loan market for a $250m refinancing.,17 Jan 2020,https://www.globalcapital.com/article/b1jy4390dp5zrk/zhongce-rubber-returns-for-$250m-refi
ICBC Asia hires two loans bankers from Hang Seng,Industrial and Commercial Bank of China (Asia) has hired two former Hang Seng loans banker to join its global capital finance department in Hong Kong.,17 Jan 2020,https://www.globalcapital.com/article/b1jy41cy9qc2jh/icbc-asia-hires-two-loans-bankers-from-hang-seng
Lalitpur Power’s bond plan fizzles out,India’s Lalitpur Power Generation Company has postponed its attempted debut dollar bond after opening bookbuilding on Thursday according to a source close to the situation.,17 Jan 2020,https://www.globalcapital.com/article/b1jy3vj9wkdc7n/lalitpur-powers-bond-plan-fizzles-out
Brazilians join party as Lat Am frenzy goes on,Issuers from Latin America’s largest economy finally began feeding a yield-hungry buy-side this week as bankers say there is little sign of investors turning their noses up at apparently rich valuations.,16 Jan 2020,https://www.globalcapital.com/article/b1jxyx53n6sjbq/brazilians-join-party-as-lat-am-frenzy-goes-on
Chilean corps tick over as sovereign preps green deal,Chemicals company SQM became the latest Chilean firm to issue internationally on Thursday as the country’s corporates continue to take advantage of high levels of liquidity to pre-fund ahead of a potentially volatile year.,16 Jan 2020,https://www.globalcapital.com/article/b1jxymvq77bqxk/chilean-corps-tick-over-as-sovereign-preps-green-deal
The power of making a fuss,As head of BlackRock the largest asset manager Larry Fink’s pivot to responsible investing in recent years has been influential.,16 Jan 2020,https://www.globalcapital.com/article/b1jxykqn7964df/the-power-of-making-a-fuss
Paraguay taps but Lat Am sovs slow to start,Latin American DCM bankers urged the region’s sovereigns to accelerate their funding plans after Paraguay notched a negative new issue premium in the sole sovereign trade of the week.,16 Jan 2020,https://www.globalcapital.com/article/b1jxy16bc0fpq4/paraguay-taps-but-lat-am-sovs-slow-to-start
Slim Mexico concessions show increasing confidence,Latin America bankers said that this week Mexico showed again that it was a leading issuer in the region after the sovereign sold its second deal of the year to take advantage of remarkable funding conditions.,16 Jan 2020,https://www.globalcapital.com/article/b1jxxx9815rzgr/slim-mexico-concessions-show-increasing-confidence
Credit Suisse launches all-in-one aircraft finance business,Credit Suisse on Thursday announced the launch of SCALE Aviation a subsidiary of the bank aiming to boost liquidity in the aircraft industry by providing capital markets financing as well as direct assistance on acquisition trading and management of aircraft collateral.,16 Jan 2020,https://www.globalcapital.com/article/b1jxxv850nn13v/credit-suisse-launches-all-in-one-aircraft-finance-business
New issue slow to build but managers price burst of CLO refis and resets,A wave of CLO refinancings and resets rolled in this week fueled by tightening spreads on triple-A paper with sources expecting the trend to continue alongside a slowly building new issue pipeline.,16 Jan 2020,https://www.globalcapital.com/article/b1jxxqz88l84r0/new-issue-slow-to-build-but-managers-price-burst-of-clo-refis-and-resets
Covered bond squeeze feared as ECB ramps up buying amid slower supply,After a brisk start to the year the pace of covered bond supply had already begun to slow by Thursday amid growing concern that the European Central Bank would be compelled to step up purchases igniting fears of a technical squeeze. Bill Thornhill reports.,16 Jan 2020,https://www.globalcapital.com/article/b1jxxd78bqmyzb/covered-bond-squeeze-feared-as-ecb-ramps-up-buying-amid-slower-supply
Tradition brings CLOB to the masses with dealer to client platform,Interdealer broker Tradition is opening the doors to central limit order book trading for buy-side swaps market participants with its Trad–X D2C platform.,16 Jan 2020,https://www.globalcapital.com/article/b1jxxb9qbzjrjf/tradition-brings-clob-to-the-masses-with-dealer-to-client-platform
UniCredit €1.25bn 1.2% Jan 26 6NC5 €750m 1.8% Jan 30 bail-in senior,,16 Jan 2020,https://www.globalcapital.com/article/b1jxx6ptlhcc2b/unicredit-125bn-12-jan-26-6nc5-750m-18-jan-30-bailin-senior
Banca Monte dei Paschi di Siena €400m 8% 10NC5 tier two,,16 Jan 2020,https://www.globalcapital.com/article/b1jxx5pn6s8v29/banca-monte-dei-paschi-di-siena-400m-8-10nc5-tier-two
Investors fight SEC curbs on ESG motions,The latest battle in the campaign to weaken corporate governance standards in the US is being fought over rule changes that would make it harder for investors to propose motions at shareholder meetings. The ‘proxy advisers’ so central to US governance also face new restrictions.,16 Jan 2020,https://www.globalcapital.com/article/b1jxxfxls2801c/investors-fight-sec-curbs-on-esg-motions
Spain breaks euro book record amid perfect storm,While every eurozone country that sold a new syndicated bond this year has received strong demand Spain outshone them all this week by taking the biggest ever order book in the bloc.,16 Jan 2020,https://www.globalcapital.com/article/b1jxx5ns9l50jl/spain-breaks-euro-book-record-amid-perfect-storm
FIG frenzy reaches fever pitch in dollars,Wall Street heavyweights piled into the dollar market with a string of tightly-priced preferred share deals after reporting full-year earnings this week amid FIG supply of $25bn in just four days.,16 Jan 2020,https://www.globalcapital.com/article/b1jxx9nw72mtnl/fig-frenzy-reaches-fever-pitch-in-dollars
IDA GBP1.5bn 0.75% Dec 24,,16 Jan 2020,https://www.globalcapital.com/article/b1jxx2b0wvmrtf/ida-gbp15bn-075-dec-24
Italy EUR7bn 2.45% Sep 50,,16 Jan 2020,https://www.globalcapital.com/article/b1jxx0y696hv42/italy-eur7bn-245-sep-50
Belgium EUR6bn 0.1% Jun 30,,16 Jan 2020,https://www.globalcapital.com/article/b1jxx0hjtyjxgd/belgium-eur6bn-01-jun-30
CEB EUR1bn 0.05% Jan 30,,16 Jan 2020,https://www.globalcapital.com/article/b1jxx3xm66lsm2/ceb-eur1bn-005-jan-30
KfW USD5bn 1.625% Feb 23,,16 Jan 2020,https://www.globalcapital.com/article/b1jxx024cfhdbs/kfw-usd5bn-1625-feb-23
EQT bounces back in dollars,US natural gas producer EQT Corp shrugged off a rating downgrade and an asset write-down to tap the dollar market for $1.75bn on Wednesday becoming one of two high-grade issuers to do so as earnings blackout took hold.,16 Jan 2020,https://www.globalcapital.com/article/b1jxx2d50g7jpl/eqt-bounces-back-in-dollars
Cyprus EUR1bn 0.625% Jan 30 EUR750m 1.25% Jan 40,,16 Jan 2020,https://www.globalcapital.com/article/b1jxx1ls8wwcx1/cyprus-eur1bn-0625-jan-30-eur750m-125-jan-40
EFSF EUR3bn 0.7% Jan 50,,16 Jan 2020,https://www.globalcapital.com/article/b1jxwz656szb0m/efsf-eur3bn-07-jan-50
Full dollar curve explored by strong SSA market,The dollar SSA bond market unfettered by geopolitical volatility enjoyed an excellent week although it is still lagging behind the euro market in terms of overall supply.,16 Jan 2020,https://www.globalcapital.com/article/b1jxwxpbxzgqsc/full-dollar-curve-explored-by-strong-ssa-market
Markets must face up to new deadlines for Libor transition,Banks should stop issuing loans and bonds linked to Libor by October according to the Bank of England’s Working Group on Sterling Risk-Free Reference Rates. But the scale of the challenge facing firms particularly in the loan market is causing concern.,16 Jan 2020,https://www.globalcapital.com/article/b1jxwy3xpfm2l3/markets-must-face-up-to-new-deadlines-for-libor-transition
SSAs reap rewards in euro long end,A triple-A rated supranational and two sovereigns from the eurozone periphery took the opportunity to lock in low rates at the long end this week amid strong market conditions. SSA bankers expect more supply to follow at this part of the curve over the coming weeks including from France and potentially Greece.,16 Jan 2020,https://www.globalcapital.com/article/b1jxwzxtwdr7q8/ssas-reap-rewards-in-euro-long-end
Spain EUR10bn 0.5% Apr 30,,16 Jan 2020,https://www.globalcapital.com/article/b1jxwzn2srh08v/spain-eur10bn-05-apr-30
Wide-open market helps Italian banks make headway on capital funding,Italian banks took over the financial institutions bond market this week enjoying a much lower cost of funding and capital than they have been accustomed to in recent years. The sector will look to make good use of favourable issuance windows in 2020 as it moves inch by inch towards a more positive outlook.,16 Jan 2020,https://www.globalcapital.com/article/b1jxx53jzgrkby/wideopen-market-helps-italian-banks-make-headway-on-capital-funding
Swissies on fire as foreign borrowers flock to market,The Swiss franc bond market has had a roaring start to the year which bankers suggest may be a sign Swiss investors are switching from equity to debt. This week’s standout trades came from Hyundai Capital National Australia Bank and Chilean financial services company Tanner while Münchener Hypothekenbank sold a first green Swiss franc bond on Thursday.,16 Jan 2020,https://www.globalcapital.com/article/b1jxwhxlxx574c/swissies-on-fire-as-foreign-borrowers-flock-to-market
Oil and gas ABS market grows despite push for ESG,Securitizations tied to oil and gas-related cash flows have emerged in recent months despite growing support from the buy side for socially responsible investments (SRI). Though they run contrary to environmental social and governance (ESG) principles issuance of oil and gas royalty ABS may persist as long as the deals offer attractive yields or until ESG investments pay a premium to brown ABS. Jennifer Kang reports.,16 Jan 2020,https://www.globalcapital.com/article/b1jxw8pvtl78jr/oil-and-gas-abs-market-grows-despite-push-for-esg
UBI Banca EUR400m 5.875% PNC Jun 25 AT1,,16 Jan 2020,https://www.globalcapital.com/article/b1jxw1rnb1yvjd/ubi-banca-eur400m-5875-pnc-jun-25-at1
Banco BPM EUR400m 6.125% PNC5 AT1,,16 Jan 2020,https://www.globalcapital.com/article/b1jxw1d9yl7mn3/banco-bpm-eur400m-6125-pnc5-at1
US buyers rush Europe ECM on bargain hunt,US investors are behind the European equity capital markets’ flying start to the year. They are swarming deals having been driven out of their home market by sky-high valuations and a volatile president fighting for political survival reports Sam Kerr.,16 Jan 2020,https://www.globalcapital.com/article/b1jxw37v50lq0t/us-buyers-rush-europe-ecm-on-bargain-hunt
Covered bond issuers price flat to fair value,A lack of supply relative to 2019 and much more aggressive central bank buying ensured that Banco Sabadell Royal Bank of Canada and OP Mortgage Bank were able to price covered bonds flat to fair value this week.,16 Jan 2020,https://www.globalcapital.com/article/b1jxw2ph4h5hhd/covered-bond-issuers-price-flat-to-fair-value
AIIB debuts as dim sum sees ‘greatest ever flow’,AIIB made its dim sum debut this week into a booming market. A slew of deals has been sold in recent weeks with more paper printed in last the last 10 days than in the whole of any other year except for 2019.,16 Jan 2020,https://www.globalcapital.com/article/b1jxx14w5ljj4g/aiib-debuts-as-dim-sum-sees-greatest-ever-flow
BNPP and Deutsche prep secondary buyout loan for Armacell,BNP Paribas and Deutsche Bank are marketing a €710m term loan 'B' to fund the secondary buyout of Armacell by PAI Partners announced just before Christmas. This will be the insulation company’s fifth LBO so it is well known to lenders who ought to support the new deal despite a downgrade last year.,16 Jan 2020,https://www.globalcapital.com/article/b1jxw21r1y2ypn/bnpp-and-deutsche-prep-secondary-buyout-loan-for-armacell
German ECM revival on the cards in 2020,German equity capital markets are off to a flying start this year buoyed by a rally in the DAX and renewed interest in European equities among US investors. There is renewed optimism about deals to come including several of this year’s largest European IPOs.,16 Jan 2020,https://www.globalcapital.com/article/b1jxvy7pv0kqqf/german-ecm-revival-on-the-cards-in-2020
French threesome covers up,BPCE Credit Mutuel Home loan (CM-CIC) and Axa Bank issued French covered bonds this week with Axa issuing its first transaction under a new and lower rated Belgian ownership structure.,16 Jan 2020,https://www.globalcapital.com/article/b1jxvznw3pg4ll/french-threesome-covers-up
Trio of Austrians find Pfandbrief favour,Austrian covered bond borrowers Bawag PSK UniCredit Bank Austria and RLB Oberösterreich found a warm reception for their €500m no-grow deals this week.,16 Jan 2020,https://www.globalcapital.com/article/b1jxvwvv2xcd3v/trio-of-austrians-find-pfandbrief-favour
CS opens AT1 dollar market with a bang,Credit Suisse became the first issuer of additional tier one (AT1) paper market in dollars this year seizing the high levels of appetite for this asset class to print through fair value.,16 Jan 2020,https://www.globalcapital.com/article/b1jxw0bqmnyr7g/cs-opens-at1-dollar-market-with-a-bang
Pfandbriefe trio price flat to their curves,Helaba Deutsche Bank and Deutsche Pfandbriefbank (PBB) had little trouble accessing the Pfandbrief market this week with a series of deals that were priced flat to their curves.,16 Jan 2020,https://www.globalcapital.com/article/b1jxvt37ndpcbd/pfandbriefe-trio-price-flat-to-their-curves
Ineos Styrolution launches €1.2bn divi and refi deal,UK chemicals giant Ineos’s German styrenics subsidiary is marketing €500m of senior secured notes and a €680m equivalent term loan B with an intention to issue a €300m dividend to its parent company controlled by billionaire Jim Ratcliffe. The remaining proceeds will be used for refinancing all of its term loans and some of the upcoming investments.,16 Jan 2020,https://www.globalcapital.com/article/b1jxvrw6lzm0h1/ineos-styrolution-launches-12bn-divi-and-refi-deal
People moves in brief,Ex-Goldman's Weber joins Middle East boutique — Giancarlo turns up at Federal Housing Finance Agency — Ferdane takes over coverage job at BNP Paribas,16 Jan 2020,https://www.globalcapital.com/article/b1jxvpctc78pkl/people-moves-in-brief
Monte is living a charmed afterlife,The stars have aligned for Banca Monte dei Paschi di Siena following its rescue by the Italian state. It is hard to see how other banks could be so fortunate.,16 Jan 2020,https://www.globalcapital.com/article/b1jxvj7dtgndt4/monte-is-living-a-charmed-afterlife
Dexia and EDC score with euro deals,A pair of SSA borrowers hit the euro market on Thursday raising a combined €2.5bn at impressive spreads. Export Development Canada raised €1bn with its second ever euro benchmark while Dexia Crédit Local was able to ratchet the spread in by 4bp on its seven year.,16 Jan 2020,https://www.globalcapital.com/article/b1jxvkvzvv10md/dexia-and-edc-score-with-euro-deals
Corporate sterling issuers launch blowout market reopening,High grade corporate names kicked off the 2020 sterling market in style this week with big books and eye-catching trades for the University of Oxford Clarion Housing and Ireland's Electricity Supply Board.,16 Jan 2020,https://www.globalcapital.com/article/b1jxv9wq4ty4w8/corporate-sterling-issuers-launch-blowout-market-reopening
Loan repricing accelerates but can CLOs keep up?,Some of the largest issuers in the leveraged finance universe are repricing their loans cutting 50bp or more from their margins on the back of strong market conditions and proven performance since the loans were raised. That is putting pressure on CLO managers and equity holders whose liabilities are tightening too but more slowly blocking repricing of the bonds and squeezing returns write Owen Sanderson and Tom Brown.,16 Jan 2020,https://www.globalcapital.com/article/b1jxvfph1m2ymd/loan-repricing-accelerates-but-can-clos-keep-up
Delivery Hero prices €2.3bn M&A financing trade,Delivery Hero the German online food ordering marketplace raised €2.3bn this week via a simultaneous placement of new shares and convertible bonds to finance its takeover of South Korea’s Woowa Brothers.,16 Jan 2020,https://www.globalcapital.com/article/b1jxvccg10kb5d/delivery-hero-prices-23bn-mampa-financing-trade
Goldman’s Weber joins new firm in Middle East,Martin Weber a former managing director at Goldman Sachs has joined a boutique emerging markets-focused investment bank in Dubai.,16 Jan 2020,https://www.globalcapital.com/article/b1jxvgr29157xq/goldmans-weber-joins-new-firm-in-middle-east
ISDA chief stresses 'critical' importance of Chinese netting,The International Swaps and Derivatives Association's CEO has called for more clarity on close-out netting in China.,16 Jan 2020,https://www.globalcapital.com/article/b1jxv877t8103v/isda-chief-stresses-39critical39-importance-of-chinese-netting
Veon USD300m tap of USD 4% Apr 25,,16 Jan 2020,https://www.globalcapital.com/article/b1jxv0wmrc2b70/veon-usd300m-tap-of-usd-4-apr-25
Sterling RMBS blowout as non-UK investors return to market,Issuers priced two sterling residential mortgage-backed securities (RMBS) deals this week with Precise Mortgage Funding 2020–1B showing an unprecedented five times coverage on senior notes and up to 12 times on the mezzanine tranches as overseas investors return to the sterling market.,16 Jan 2020,https://www.globalcapital.com/article/b1jxv3f7mw2406/sterling-rmbs-blowout-as-non-uk-investors-return-to-market
TSKB USD400m 6% Jan 20,,16 Jan 2020,https://www.globalcapital.com/article/b1jxv06h84zst7/tskb-usd400m-6-jan-20
Phosagro USD500m 3.05% Jan 25,,16 Jan 2020,https://www.globalcapital.com/article/b1jxtzc14rt9c0/phosagro-usd500m-305-jan-25
First Abu Dhabi Bank USD500m 2.526% Jan 25,,16 Jan 2020,https://www.globalcapital.com/article/b1jxtyx74ks9x2/first-abu-dhabi-bank-usd500m-2526-jan-25
Bahrain Mumtalakat USD500m 4.25% Jan 27,,16 Jan 2020,https://www.globalcapital.com/article/b1jxtxxfv5lwhv/bahrain-mumtalakat-usd500m-425-jan-27
Morgan Stanley and compatriots raise the FICC bar,Morgan Stanley more than doubled its revenue from fixed income sales and trading in the fourth quarter of last year completing a stellar set of earnings for US banks in that business after a year in which they appear to have cemented their dominance in Europe.,16 Jan 2020,https://www.globalcapital.com/article/b1jxttk37drcnx/morgan-stanley-and-compatriots-raise-the-ficc-bar
Luminor Bank steps closer to covered bond issuance with Moody’s rating,An Estonian covered bond could soon be due in the market after Moody’s rated Luminor Bank’s programme this week — the first to be structured under the country’s newly established law. The rating comes after the European Central Bank granted Luminor a license to issue covered bonds in December.,16 Jan 2020,https://www.globalcapital.com/article/b1jxts3xs58rrq/luminor-bank-steps-closer-to-covered-bond-issuance-with-moodys-rating
Corporate green bond issuance hits record levels,The European socially responsible investment corporate bond market has made a rampant start this year with issuance in the first two weeks already more than 10% of the total issued by companies in European currencies in 2019.,16 Jan 2020,https://www.globalcapital.com/article/b1jxtlb93tm3pb/corporate-green-bond-issuance-hits-record-levels
IDA grabs record book with sterling debut,The International Development Association (IDA) impressed with its debut sterling bond on Thursday as it received the largest ever order book for the currency in the SSA market. It also equalled the biggest ever trade in sterling by a non-UK public sector borrower.,16 Jan 2020,https://www.globalcapital.com/article/b1jxtjfgs8m1zw/ida-grabs-record-book-with-sterling-debut
NordLB Lux mandates for first renewable energy deal again,NordLB Luxembourg was expected to arrive in the market with its inaugural renewable energy covered bond late last year having completed a market programme and mandated lead managers. On Thursday it finally plucked up the courage to re-announce the long-awaited deal — the first to be ever issued under the country’s new law.,16 Jan 2020,https://www.globalcapital.com/article/b1jxtl9mg9jtq2/nordlb-lux-mandates-for-first-renewable-energy-deal-again
