Although SSAs are offering little in the way of yield their place as pioneers of the evolving SRI market always ensures lively debate. In this roundtable held in early November market participants on both the buyside and the sell side favoured a more holistic assessment of issuers’ ESG profiles rather than relying on labelled assets but whether or not the ECB should take a role in promoting the SRI market through “green QE” divided the group.,13 Jan 2020,https://www.globalcapital.com/article/b1jwdql0mf1dvk/climate-and-digitisation-to-dominate-ssas-2020
CréditAg adds to China debt origination team,Matthew Xu has become an executive director of debt capital markets in Crédit Agricole’s China debt origination and advisory team effective Monday.,13 Jan 2020,https://www.globalcapital.com/article/b1jwd7xjyq9p88/cr233ditag-adds-to-china-debt-origination-team
Investors support Asian bond market boom,Ten more Asian issuers rushed to the dollar bond market on Monday further adding to the record debt issuance seen in the region last week.,13 Jan 2020,https://www.globalcapital.com/article/b1jwc93362wvtn/investors-support-asian-bond-market-boom
ENN Ecological makes debut with $200m loan,Chinese liquefied natural gas supplier ENN Ecological Holdings Co has made its debut in the offshore loan market through Standard Chartered.,13 Jan 2020,https://www.globalcapital.com/article/b1jwc3kl0k6k76/enn-ecological-makes-debut-with-$200m-loan
Luckin Coffee nabs $980m from bigger CB follow-on combo,China’s challenger to Starbucks Luckin Coffee has raised $979.6m after increasing the size of a combined sale of new shares and a convertible bond the first tap of the ADS equity-linked market in 2020.,13 Jan 2020,https://www.globalcapital.com/article/b1jwc103dk71ql/luckin-coffee-nabs-980m-from-bigger-cb-followon-combo
Mexico proving economic prowess says DMO after blow-out bond,Mexico’s head of public credit told GlobalCapital that he felt the government’s economic management was winning over investors after the sovereign notched a heavily oversubscribed dollar deal last week.,13 Jan 2020,https://www.globalcapital.com/article/b1jw9rk1m9txlh/mexico-proving-economic-prowess-says-dmo-after-blowout-bond
Andina to follow Femsa as Lat Am corps show bottle,Embotelladora Andina the third largest Coca-Cola bottler in Latin America and seventh largest in the world will begin a roadshow on Monday ahead of an expected 10 year bond.,13 Jan 2020,https://www.globalcapital.com/article/b1jw9ssggkdgw5/andina-to-follow-femsa-as-lat-am-corps-show-bottle
Yes Bank stock dives as $1.4bn deal wins board nod,Yes Bank's share price collapsed in Monday morning trading after the Indian lender’s board of directors approved a potential billion-dollar equity fundraising.,13 Jan 2020,https://www.globalcapital.com/article/b1jw9vcxbxxy65/yes-bank-stock-dives-as-14bn-deal-wins-board-nod
The week in review: MoF boosts state-owned pension fund status Shenzhen bourse to get new chairman phase one trade deal translation settled,In this round-up the Chinese Ministry of Finance (MoF) transferred 10% of its shares in three large commercial banks to the state-owned social security fund the Shenzhen Stock Exchange is set to welcome a new chairman and the US treasury secretary has denied rumours of inaccurate translation of the phase one trade deal.,13 Jan 2020,https://www.globalcapital.com/article/b1jw9jz2r94cgz/the-week-in-review-mof-boosts-stateowned-pension-fund-status-shenzhen-bourse-to-get-new-chairman-phase-one-trade-deal-translation-settled
Constellis default could drive big CLO losses Moody's says,Over 200 CLOs could be hit with losses as a result of a default by security and defense firm Constellis according to Moody’s.,10 Jan 2020,https://www.globalcapital.com/article/b1jv9cf28lrjmg/constellis-default-could-drive-big-clo-losses-moody39s-says
General Mills raises dough,US food group General Mills sold €200m of short dated notes on Wednesday in its first sole-led deal since 2017.,10 Jan 2020,https://www.globalcapital.com/article/b1jv4r0nx6vd1m/general-mills-raises-dough
Investors pour into Nexi in first trade since IPO,Equity capital markets investors jumped at the chance to buy shares in Nexi the Italian payments company as it returned with its first transaction since IPO.,10 Jan 2020,https://www.globalcapital.com/article/b1jv3vt6xvkt4h/investors-pour-into-nexi-in-first-trade-since-ipo
LSEG hires Roos for capital markets,Murray Roos former joint head of equities at Citi has turned up at London Stock Exchange Group.,10 Jan 2020,https://www.globalcapital.com/article/b1jv3gtwbfmhgr/lseg-hires-roos-for-capital-markets
BBVA picks Friday window for T2 amid 'massive demand' for capital,BBVA founds itself alone in the euro FIG market on Friday as it launched a €1bn tier two bond on the back of €4bn of demand. The deal caps off a busy week for supply in which investors have shown out-sized demand for the highest yielding transactions.,10 Jan 2020,https://www.globalcapital.com/article/b1jv3cs9pshygt/bbva-picks-friday-window-for-t2-amid-39massive-demand39-for-capital
First Watches of Switzerland block prices well,US private equity group Apollo Global Management has completed the first selldown of stock in Watches of Switzerland the UK luxury watches retailer since its flotation on the London Stock Exchange in May last year.,10 Jan 2020,https://www.globalcapital.com/article/b1jv3nd2ljl6tp/first-watches-of-switzerland-block-prices-well
RLB OÖ mandates for 15 year ahead of ‘crowded’ expectations,Raiffeisenlandesbank Oberösterreich has signalled that it will issue a new 15 year covered bond in the euro market next week with the Austrian bank keen to book its spot in an extremely crowded market.,10 Jan 2020,https://www.globalcapital.com/article/b1jv35mntj15b1/rlb-o214-mandates-for-15-year-ahead-of-crowded-expectations
China policy round-up: phase one trade deal coming Safe deputy chief heads to Guangdong State Council urges more support for SMEs,In this round-up Chinese vice premier Liu He will visit Washington DC next Monday until Wednesday the State Administration of Foreign Exchange sends its deputy administrator to Guangdong and the Financial Stability and Development Committee reaffirmed the importance of small and medium-sized enterprises.,10 Jan 2020,https://www.globalcapital.com/article/b1jv1p8c0c28zc/china-policy-roundup-phase-one-trade-deal-coming-safe-deputy-chief-heads-to-guangdong-state-council-urges-more-support-for-smes
China market round-up: CPI inflation moderates Baoshang Bank gets a buyer ICBC to issue capital instruments,In this round-up China’s December consumer price index inflation flattened Anhui-based Huishang Bank is considering taking over 15% of Baoshang Bank and Industrial and Commercial Bank of China is set to sell Rmb80bn ($11.5bn) of offshore perpetual bonds and onshore tier two bonds this year.,10 Jan 2020,https://www.globalcapital.com/article/b1jv1mvt0f2xmj/china-market-roundup-cpi-inflation-moderates-baoshang-bank-gets-a-buyer-icbc-to-issue-capital-instruments
Shriram's social bond gets stellar US support,Shriram Transport Finance Co appealed to investors in the US by selling a social bond that flew off the shelves allowing the Indian non-banking financial company to raise $500m.,10 Jan 2020,https://www.globalcapital.com/article/b1jv15ptm3fld4/shriram39s-social-bond-gets-stellar-us-support
Sunac China and WuXi Bio tap Hong Kong for $1.8bn,Mainland-based property developer Sunac China Holdings has raised HK$8bn ($1.03bn) after issuing a chunk of new shares.,10 Jan 2020,https://www.globalcapital.com/article/b1jv18bd7vx4l3/sunac-china-and-wuxi-bio-tap-hong-kong-for-18bn
AEV debuts after intense price discovery,Price discovery was in focus for a $400m debut bond from Philippine conglomerate Aboitiz Equity Ventures (AEV) on Thursday as the unrated company brought out a rare 10 non-call five year senior deal from the country.,10 Jan 2020,https://www.globalcapital.com/article/b1jv128w65n1f2/aev-debuts-after-intense-price-discovery
Bonds news in brief: LGFVs developers feast on dollars,Improved market conditions and a more realistic pricing target allowed a failed deal in December from a local government financing vehicle (LGFV) to sail through this week while two more property developers joined an offshore funding spree from the sector.,10 Jan 2020,https://www.globalcapital.com/article/b1jv1028gx9vwd/bonds-news-in-brief-lgfvs-developers-feast-on-dollars
PTTEP nabs $350m from 10yr outing,Thailand's PTT Exploration and Production Public Co made a quick return to the debt market on Thursday selling a 10 year bond less than two months after closing a 40 year deal.,10 Jan 2020,https://www.globalcapital.com/article/b1jv0y5dlg651r/pttep-nabs-$350m-from-10yr-outing
Hong Kong IPOs: Jiumaojiu closes hot Huijing prices low,Jiumaojiu International Holdings bagged HK$2.2bn ($283.3m) this week from its IPO after bulging retail and institutional books pushed pricing to the top of guidance according to a source familiar with the matter.,10 Jan 2020,https://www.globalcapital.com/article/b1jv0xbz918sws/hong-kong-ipos-jiumaojiu-closes-hot-huijing-prices-low
MUFG names China corporate banking head,MUFG Bank has hired a veteran Citi banker to lead its corporate banking business in China.,10 Jan 2020,https://www.globalcapital.com/article/b1jv0k45ksx00s/mufg-names-china-corporate-banking-head
BOC lands tight pricing for dollar euro triple-trancher,Bank of China kicked off the year’s supply from Asian lenders by raising close to $2.5bn from three senior bonds in dollars and euros.,10 Jan 2020,https://www.globalcapital.com/article/b1jtzds1k001p4/boc-lands-tight-pricing-for-dollar-euro-tripletrancher
Banks tune in to Tencent’s Universal Music acquisition loan,Chinese technology company Tencent Holdings is set to sign a €1bn club loan to support its acquisition of a stake in Universal Music Group.,10 Jan 2020,https://www.globalcapital.com/article/b1jtzg5m53xwxr/banks-tune-in-to-tencents-universal-music-acquisition-loan
Yuexiu scores second interbank Panda bond,Yuexiu Transport Infrastructure a Hong Kong-listed investor and operator of highways and bridges in China's Guangdong province sealed its second Rmb1bn ($144m) Panda bond on Thursday.,10 Jan 2020,https://www.globalcapital.com/article/b1jtz0jkbx4w5h/yuexiu-scores-second-interbank-panda-bond
Sustainability loans need rating agencies,The sustainability-linked loan market is a glorious mess.,10 Jan 2020,https://www.globalcapital.com/article/b1jtwsl1wst787/sustainability-loans-need-rating-agencies
LMA to guide banks on how to avoid greenwashing in sustainable loans,The loan market’s trade bodies are preparing to give new guidance about how to ensure sustainability-linked loans — in which borrowers can get a margin reduction if they hit sustainability targets — are genuinely “ambitious”. Bankers want to protect the market from rising concerns that some deals’ terms are too easy on the borrowers.,09 Jan 2020,https://www.globalcapital.com/article/b1jtwd25nfjlrz/lma-to-guide-banks-on-how-to-avoid-greenwashing-in-sustainable-loans
Mexico leads out Lat Am’s leap for liquidity,Mexico returned to its role of opening Latin American bond markets for the year on Monday triggering a slew of issuance from the region as bankers predict the bulk of 2020 supply will come in the first half.,09 Jan 2020,https://www.globalcapital.com/article/b1jtw0c19nz4gs/mexico-leads-out-lat-ams-leap-for-liquidity
TPL kicks off Colombia as Bancolombia seeks refi,Generation company Termocandelaria Power Limited (TPL) returned to capital markets on Thursday to start Colombian bond issuance for the year. The sovereign is expected to follow suit soon.,09 Jan 2020,https://www.globalcapital.com/article/b1jtvp84plxcq9/tpl-kicks-off-colombia-as-bancolombia-seeks-refi
Finanzagentur sure green Bunds will be liquid,Germany’s debt management office the Finanzagentur is confident its green bonds will be liquid when the first issue is launched in the second half of 2020 and has high hopes that they will trade tightly relative to ordinary Bunds. Its innovative plan to use a “twin bond” structure is designed to reassure investors and remove any doubt about liquidity.,09 Jan 2020,https://www.globalcapital.com/article/b1jtvp4nxkq8qv/finanzagentur-sure-green-bunds-will-be-liquid
Danske Bank GBP750m 2.25% Jan 28,,09 Jan 2020,https://www.globalcapital.com/article/b1jtv2jxt7pq0m/danske-bank-gbp750m-225-jan-28
BNP Paribas GBP850m 1.875% Dec 27,,09 Jan 2020,https://www.globalcapital.com/article/b1jtv2s3tnbzsd/bnp-paribas-gbp850m-1875-dec-27
UniCredit EUR1.25bn 2.731% Jan 32 tier two,,09 Jan 2020,https://www.globalcapital.com/article/b1jtv3ccl9s0yc/unicredit-eur125bn-2731-jan-32-tier-two
Crédit Agricole EUR1.25bn 0.875% Jan 32 senior,,09 Jan 2020,https://www.globalcapital.com/article/b1jtv304bz570m/cr233dit-agricole-eur125bn-0875-jan-32-senior
BNP Paribas EUR1bn 1.125% Jan 32 tier two,,09 Jan 2020,https://www.globalcapital.com/article/b1jtv2qkv6168b/bnp-paribas-eur1bn-1125-jan-32-tier-two
BBVA EUR1bn 0.5% Jan 27,,09 Jan 2020,https://www.globalcapital.com/article/b1jtv25vwfbwvj/bbva-eur1bn-05-jan-27
Banque Fédérative du Crédit Mutuel EUR1bn 0.75% Jan 30,,09 Jan 2020,https://www.globalcapital.com/article/b1jtv1xsgqs5pm/banque-f233d233rative-du-cr233dit-mutuel-eur1bn-075-jan-30
Chileans storm back to bonds to shrug off political uncertainty,Four Chilean issuers raised dollar funding in the first three days of the first full week of 2020 as hefty order books suggested investors shared the government’s confidence in the country’s outlook.,09 Jan 2020,https://www.globalcapital.com/article/b1jtv285ntxzbn/chileans-storm-back-to-bonds-to-shrug-off-political-uncertainty
ABN Amro EUR1.25bn 0.6% Jan 27,,09 Jan 2020,https://www.globalcapital.com/article/b1jtv1lqb358q5/abn-amro-eur125bn-06-jan-27
January sales draw huge orders,More than $30bn of dollar high grade bonds were printed in the US in the first four working days of 2020 as the year got off to a scorching start.,09 Jan 2020,https://www.globalcapital.com/article/b1jtv2by1l8rxr/january-sales-draw-huge-orders
Issuers flock to long ends in covered bonds,Issuers this week have steered clear of negative yielding covered bonds choosing longer maturities for their securities. Crédit Agricole Italia went as far as 25 years while on the other end was Santander UK marketing a seven year tenor.,09 Jan 2020,https://www.globalcapital.com/article/b1jttvcjlzj29w/issuers-flock-to-long-ends-in-covered-bonds
Brexit is just beginning,While voters who wanted to get Brexit done won a clear path to leave the European Union in December’s general election the financial industry should be preparing itself for a protracted period of scattered and gruelling negotiations.,09 Jan 2020,https://www.globalcapital.com/article/b1jtts7sgy9wx1/brexit-is-just-beginning
ESMA releases reaction to Nasdaq CCP blow-up,The European Securities and Markets Authority has published the outcome of its analysis and follow up actions on central clearing counterparties' membership criteria and due diligence in the wake of the 2018 default at Nasdaq Clearing.,09 Jan 2020,https://www.globalcapital.com/article/b1jtttbq2vyk31/esma-releases-reaction-to-nasdaq-ccp-blow-up
Portugal EUR4bn 0.475% Oct 30,,09 Jan 2020,https://www.globalcapital.com/article/b1jtthn09k8yvk/portugal-eur4bn-0475-oct-30
FIG bankers take heart from resilient secondaries,DCM officials were encouraged by the sight of new bank bonds performing well in the secondary market this week amid a deluge of new issuance from the sector.,09 Jan 2020,https://www.globalcapital.com/article/b1jtv0yfc2skxd/fig-bankers-take-heart-from-resilient-secondaries
2020 consumer ABS starts strong as buyers pile into new deals,The consumer ABS market is off to a strong start with new issues coming out back to back and leaving the pipeline just as fast. The strong demand is being driven by investors' view of ABS as cheap alternative to corporates which have rallied since the fourth quarter of last year.,09 Jan 2020,https://www.globalcapital.com/article/b1jttkszf670ck/2020-consumer-abs-starts-strong-as-buyers-pile-into-new-deals
Yankees burst off the blocks in 2020,Yankee banks set a scorching pace for issuance in the first week of 2020 as they took advantage of red-hot funding conditions.,09 Jan 2020,https://www.globalcapital.com/article/b1jttmd5vz6grg/yankees-burst-off-the-blocks-in-2020
Land NRW EUR1.3bn 1.375% Jan 20,,09 Jan 2020,https://www.globalcapital.com/article/b1jttj2kxb3005/land-nrw-eur13bn-1375-jan-20
Ireland EUR4bn 0.4% Jan 25,,09 Jan 2020,https://www.globalcapital.com/article/b1jttdwkfktwdm/ireland-eur4bn-04-jan-25
BNG EUR2bn 0.1% Jan 30,,09 Jan 2020,https://www.globalcapital.com/article/b1jtth1xsck3pp/bng-eur2bn-01-jan-30
World Bank USD3.5bn 1.625% Jan 25,,09 Jan 2020,https://www.globalcapital.com/article/b1jttghkjchkmp/world-bank-usd35bn-1625-jan-25
NWB USD2bn 1.75% Jan 25,,09 Jan 2020,https://www.globalcapital.com/article/b1jttfz9rvg4pm/nwb-usd2bn-175-jan-25
Banks tap exceptional markets to get tricky deals out of the way,A big first week back for FIG issuers has seen many of them break with tradition and prioritise their riskiest transactions feeding them into an investor base that is abundant with cash and hungry for yield writes Tyler Davies.,09 Jan 2020,https://www.globalcapital.com/article/b1jttcklt7lsxc/banks-tap-exceptional-markets-to-get-tricky-deals-out-of-the-way
Euro SSA market reopens with a bang,The euro public sector bond market kicked off in style this week as investors put cash to work following a lack of supply in the fourth quarter of 2019 fuelling record book sizes and minimal concessions.,09 Jan 2020,https://www.globalcapital.com/article/b1jttgs1cyrkzb/euro-ssa-market-reopens-with-a-bang
MuniFin EUR1.5bn 0% Nov 24,,09 Jan 2020,https://www.globalcapital.com/article/b1jttfk5bjr2lh/munifin-eur15bn-0-nov-24
KfW EUR5bn 0% Feb 25,,09 Jan 2020,https://www.globalcapital.com/article/b1jttdc2xk7cg1/kfw-eur5bn-0-feb-25
EIB USD4bn 1.625% Mar 25,,09 Jan 2020,https://www.globalcapital.com/article/b1jttcvqfcgwlh/eib-usd4bn-1625-mar-25
Banks flock to sterling in 'delayed reaction' to Brexit election,Foreign and domestic banks flocked to the UK this week as they sought to take advantage of stellar funding conditions in the sterling market. Bankers said this was the first chance issuers had to benefit from opportunities in the currency following December’s general election which removed a lot of short-term uncertainty around Brexit.,09 Jan 2020,https://www.globalcapital.com/article/b1jtthxl7ysdqq/banks-flock-to-sterling-in-39delayed-reaction39-to-brexit-election
KfW GBP1.5bn 0.875% Jul 24,,09 Jan 2020,https://www.globalcapital.com/article/b1jttc9bm71xxj/kfw-gbp15bn-0875-jul-24
SSAs and FIG seize sizzling sterling amid Brexit bounce,The sterling bond market usually buoyant enough at the start of a year got a Brexit boost this week allowing public sector borrowers and financial institutions to take full advantage. Investors piled into deals following greater clarity on the UK’s looming exit from the EU but before possible volatility around the January 31 departure date. Burhan Khadbai  and David Freitas report.,09 Jan 2020,https://www.globalcapital.com/article/b1jttclrpc73fv/ssas-and-fig-seize-sizzling-sterling-amid-brexit-bounce
Commodities position limit debate to kick off again as NGOs eye ESMA consultation,As market participants sent in their final responses to the European Securities and Markets Authority's consultation on MiFID II’s commodity derivatives position limits NGOs look set to fight against financial industry suggestions. An Oxfam official said he was “worried and disappointed” by the exercise.,09 Jan 2020,https://www.globalcapital.com/article/b1jtt2sc8vr1yw/commodities-position-limit-debate-to-kick-off-again-as-ngos-eye-esma-consultation
Aker BP flexes new muscles and targets IG buyers,Norwegian oil exploration and production company Aker BP took advantage of its second investment grade rating out of three received in November to position itself as an investment grade issuer and print a dual tranche five and 10 year deal this week.,09 Jan 2020,https://www.globalcapital.com/article/b1jtt5xtjz4mk1/aker-bp-flexes-new-muscles-and-targets-ig-buyers
Supras and agencies notch big wins despite unrest,The public sector debt market has had a superb start to 2020 breaking records right and left in defiance of geopolitical tensions that in previous years would have scuppered the market as it left the dock writes Lewis McLellan.,09 Jan 2020,https://www.globalcapital.com/article/b1jtt5p82902t7/supras-and-agencies-notch-big-wins-despite-unrest
Ashland hits buoyant market to move to unsecured cap stack,Kentucky-based speciality chemicals company Ashland sold a €500m eight year non-call life unsecured high yield issue on Thursday bringing European high yield's first proper deal of the year as part of its efforts to clean up its capital structure and switch to an unsecured financing profile.,09 Jan 2020,https://www.globalcapital.com/article/b1jtt08b4x7wpq/ashland-hits-buoyant-market-to-move-to-unsecured-cap-stack
Altice International storms strong market with €2.8bn hits lowest ever coupon,Altice International jumped at this week’s strong market conditions launching a €2.8bn-equivalent refinancing hitting the lowest ever coupon level for the telecoms group and saving itself €187m in annual interest. The strong execution with a size increase and performance in the aftermarket shows a market wide open for other well-followed high yield names looking for a refinancing opportunity.,09 Jan 2020,https://www.globalcapital.com/article/b1jtsp05w07rqp/altice-international-storms-strong-market-with-28bn-hits-lowest-ever-coupon
World Bank’s cat bonds a win for all says analyst,Catastrophe bonds issued by the World Bank have been positive for both investors and the countries receiving protection from the securities according to one market veteran. The organisation’s activity in insurance-linked securities has been highly innovative but has also received criticism from some quarters.,09 Jan 2020,https://www.globalcapital.com/article/b1jtq2nzvgh6zm/world-banks-cat-bonds-a-win-for-all-says-analyst
People moves in brief,Funding Circle picks up former securitization syndicator — Campbell moves from HSBC to RBC — Long-time DCM banker turns up at Aramco,09 Jan 2020,https://www.globalcapital.com/article/b1jtsqggx6y2w4/people-moves-in-brief
Israel USD1bn 2% Jan 30 USD2bn 3.375% Jan 50,,09 Jan 2020,https://www.globalcapital.com/article/b1jtxqgxfffn3b/israel-usd1bn-2-jan-30-usd2bn-3375-jan-50
New CLO managers flock to Europe to prey on downgrades,The European CLO market is marking the new year by bracing itself for a series of corporate downgrades. Ellington a US CLO manager has been sounding out the European market about bringing an ‘enhanced CLO’ in the first half of the year which would allow for up to 50% of the portfolio to be debt rated triple-C or below a far cry from the standard 7.5%.,09 Jan 2020,https://www.globalcapital.com/article/b1jts4njk2hp2t/new-clo-managers-flock-to-europe-to-prey-on-downgrades
GlobalCapital Americas Derivatives Awards 2020: the nominees,GlobalCapital is delighted to announce the nominees for this year’s Americas Derivatives awards.,09 Jan 2020,https://www.globalcapital.com/article/b1jts3g7zsdh2r/globalcapital-americas-derivatives-awards-2020-the-nominees
JP Morgan places $575m bond exchangeable into Alibaba stock,JP Morgan has issued a $575m synthetic bond exchangeable into the American depositary receipts of Alibaba the Chinese e-commerce company.,09 Jan 2020,https://www.globalcapital.com/article/b1jts2w09x8gt7/jp-morgan-places-$575m-bond-exchangeable-into-alibaba-stock
Maple market opens with green shoots,A pair of supranationals opened the Maple market with sustainability bonds this week. The Canadian green market is “going through a growth phase” as more and more domestic investors show interest in the product according to bankers.,09 Jan 2020,https://www.globalcapital.com/article/b1jtsnkw4wzj6f/maple-market-opens-with-green-shoots
EM swings from fear to fest amid US-Iran crisis,A week that started with a panic about the potential for conflict between Iran and the US appeared to end with capital market issuance conditions so good as to be marked “10 out of 10”. As the loan market defied Middle East risk borrowers and bond bankers are gearing up for a week ahead of huge issuance while equity bankers are ruing missed opportunities. Sam Kerr Mariam Meskin and Francesca Young report.,09 Jan 2020,https://www.globalcapital.com/article/b1jtrlvyzwshx0/em-swings-from-fear-to-fest-amid-us-iran-crisis
LeasePlan holding company taps to take out sub notes,Lincoln Financing the holding company of LeasePlan hass tapped its senior secured 2024s for an extra €500m looking to pay down payment-in-kind notes and fund its interest reserve. The deal follows last year’s €1.35bn issue which paid down debt incurred when a sponsor consortium bought the company in 2016.,09 Jan 2020,https://www.globalcapital.com/article/b1jtrjh4g9kk3j/leaseplan-holding-company-taps-to-take-out-sub-notes
EIB breaks euro book record World Bank prints joint-biggest size,The European Investment Bank and World Bank kept the strong momentum flowing in the euro public sector bond market on Thursday hitting the sweet spot with 10 and seven year benchmarks respectively.,09 Jan 2020,https://www.globalcapital.com/article/b1jtrs6mykl0dl/eib-breaks-euro-book-record-world-bank-prints-jointbiggest-size
